{
  "rawStoryCount": 14,
  "normalizedStoryCount": 14,
  "exactDuplicateCount": 13,
  "sameSourceDuplicateCount": 0,
  "syndicatedDuplicateCount": 0,
  "dropReasons": {},
  "dedupedStoryCount": 1,
  "clusterCount": 1,
  "anchorCount": 1,
  "anchorMatchedParentCount": 1,
  "angleDistribution": {
    "base_report": 1
  },
  "rankedParentCount": 1,
  "selectedParentCount": 1,
  "weakParentCount": 0,
  "droppedWeakParentCount": 0,
  "sourceDistribution": {}
}